{
  "$schema": "https://json-schema.org/draft/2020-12/schema",
  "$id": "https://ota.example/schemas/build.schema.json",
  "title": "ota-build build.json",
  "description": "<build dir>/build.json written by `ota-build bundle` (packages/ota-build/src/bundle.ts, interface BuildJson). Lists the Hermes bytecode files of a platform build with their hashes and the toolchain that made them. Consumed by `ota-build patch`, `base-info` and verifyBuildDir (which re-hashes every referenced file). Hashes here are \"sha256:\" + 64 hex. The optional `delta` block records whether the .hbc files were compiled with `hermesc -base-bytecode` (patch builds) and the sha256 of every JS input. NOT expressible: delta.enabled iff delta.baseBuild is non-null; delta.files lists exactly host + units; baseHbc present on every file when enabled; referenced files exist and match their hash; host/unit toolchain versions agree.",
  "type": "object",
  "additionalProperties": false,
  "required": [
    "schema",
    "platform",
    "appVersion",
    "sourceSha",
    "toolchain",
    "host",
    "units",
    "ids",
    "unitsMap"
  ],
  "properties": {
    "schema": {
      "const": 1,
      "description": "build.json format version."
    },
    "platform": {
      "enum": [
        "android",
        "ios"
      ],
      "description": "Platform of this build."
    },
    "appVersion": {
      "type": [
        "string",
        "null"
      ],
      "description": "Binary release line (--app-version); null when not given."
    },
    "sourceSha": {
      "type": [
        "string",
        "null"
      ],
      "description": "Source commit (--source-sha); null when not given."
    },
    "toolchain": {
      "type": "object",
      "additionalProperties": false,
      "required": [
        "rn",
        "metro",
        "hermescSha256",
        "hbcVersion",
        "hermescFlags"
      ],
      "description": "Toolchain identity; patches are only valid between builds with an identical toolchain.",
      "properties": {
        "rn": {
          "type": "string",
          "minLength": 1,
          "description": "React Native version, e.g. \"0.78.3\"."
        },
        "metro": {
          "type": "string",
          "minLength": 1,
          "description": "Metro version used by the splitter, e.g. \"0.81.5\"."
        },
        "hermescSha256": {
          "$ref": "#/$defs/hash",
          "description": "sha256 of the hermesc binary."
        },
        "hbcVersion": {
          "type": "integer",
          "minimum": 1,
          "description": "Hermes bytecode version, e.g. 96."
        },
        "hermescFlags": {
          "type": "string",
          "description": "Exact hermesc flags, e.g. \"-O -emit-binary -g0\"."
        }
      }
    },
    "host": {
      "$ref": "#/$defs/file",
      "description": "The host bytecode bundle (host.hbc)."
    },
    "units": {
      "type": "object",
      "description": "Unit bytecode bundles keyed by unit name.",
      "additionalProperties": {
        "$ref": "#/$defs/unitFile"
      }
    },
    "ids": {
      "$ref": "#/$defs/ref",
      "description": "ids.json (module id -> path) copied from the splitter."
    },
    "unitsMap": {
      "$ref": "#/$defs/ref",
      "description": "The splitter's output units.json (see units.output.schema.json), copied into the build dir."
    },
    "delta": {
      "type": "object",
      "additionalProperties": false,
      "required": [
        "enabled",
        "baseBuild",
        "files"
      ],
      "description": "Hermes delta compile record (absent in builds made before delta mode). Base releases and `--delta off` builds have enabled false; files then carry only the js hashes.",
      "properties": {
        "enabled": {
          "type": "boolean",
          "description": "True if every file was compiled with `hermesc -base-bytecode=<embedded base .hbc>` (unchanged files are copied from the base)."
        },
        "baseBuild": {
          "type": [
            "string",
            "null"
          ],
          "pattern": "^sha256:[0-9a-f]{64}$",
          "description": "sha256 of the base build's build.json (always the EMBEDDED base build, never a delta build); null when enabled is false."
        },
        "files": {
          "type": "object",
          "description": "Per-file record keyed by the build-relative .hbc path (\"host.hbc\", \"units/cabs.hbc\").",
          "additionalProperties": {
            "type": "object",
            "additionalProperties": false,
            "required": [
              "js"
            ],
            "properties": {
              "baseHbc": {
                "$ref": "#/$defs/hash",
                "description": "sha256 of the base .hbc used as -base-bytecode for this file (only when enabled)."
              },
              "js": {
                "$ref": "#/$defs/hash",
                "description": "sha256 of the JS file (splitter output) this .hbc was compiled from; equal JS in base and new build means the base .hbc is copied unchanged."
              }
            }
          }
        }
      }
    }
  },
  "$defs": {
    "hash": {
      "type": "string",
      "pattern": "^sha256:[0-9a-f]{64}$",
      "description": "\"sha256:\" + 64 lowercase hex chars."
    },
    "file": {
      "type": "object",
      "required": [
        "file",
        "hash",
        "size",
        "zstdSize"
      ],
      "properties": {
        "file": {
          "type": "string",
          "minLength": 1,
          "description": "Path relative to the build dir, e.g. \"host.hbc\" or \"units/cabs.hbc\"."
        },
        "hash": {
          "$ref": "#/$defs/hash",
          "description": "sha256 of the file bytes."
        },
        "size": {
          "type": "integer",
          "minimum": 0,
          "description": "File size in bytes."
        },
        "zstdSize": {
          "type": "integer",
          "minimum": 0,
          "description": "Size of the file zstd-compressed, in bytes (base for the size-ratio limits)."
        }
      },
      "additionalProperties": false
    },
    "ref": {
      "type": "object",
      "additionalProperties": false,
      "required": [
        "file",
        "hash"
      ],
      "properties": {
        "file": {
          "type": "string",
          "minLength": 1,
          "description": "Path relative to the build dir."
        },
        "hash": {
          "$ref": "#/$defs/hash",
          "description": "sha256 of the file bytes."
        }
      }
    },
    "unitFile": {
      "type": "object",
      "required": [
        "file",
        "hash",
        "size",
        "zstdSize",
        "entryModuleId"
      ],
      "properties": {
        "file": {
          "type": "string",
          "minLength": 1,
          "description": "Path relative to the build dir, e.g. \"host.hbc\" or \"units/cabs.hbc\"."
        },
        "hash": {
          "$ref": "#/$defs/hash",
          "description": "sha256 of the file bytes."
        },
        "size": {
          "type": "integer",
          "minimum": 0,
          "description": "File size in bytes."
        },
        "zstdSize": {
          "type": "integer",
          "minimum": 0,
          "description": "Size of the file zstd-compressed, in bytes (base for the size-ratio limits)."
        },
        "entryModuleId": {
          "type": "integer",
          "minimum": 0,
          "description": "Module id of the unit entry (from the splitter units.json entryId); must not change between base and patch builds."
        }
      },
      "additionalProperties": false
    }
  }
}
