{
  "schema": 1,
  "platform": "android",
  "appVersion": "11.9.0",
  "sourceSha": "aaaaaaaaaaaaaaaaaaaaaaaaaaaaaaaaaaaaaaaa",
  "toolchain": {
    "rn": "0.78.3",
    "metro": "0.81.5",
    "hermescSha256": "sha256:a82e519e1fa3737f6b95554cdb9edaaf37458fb03abcdc2144f039fa0b3302ab",
    "hbcVersion": 96,
    "hermescFlags": "-O -emit-binary -g0"
  },
  "host": {
    "file": "host.hbc",
    "hash": "sha256:c4ff882ba5a093546504872fb7966d3cb5587b4ba44b87c9977db865f2eed9ba",
    "size": 28800,
    "zstdSize": 16046
  },
  "units": {
    "bus": {
      "file": "units/bus.hbc",
      "hash": "sha256:9ce88ab0b25d81367b6ceca5fb45cd95fdc8d6a056d5f20d582eb1fbbd082f59",
      "size": 1244,
      "zstdSize": 857,
      "entryModuleId": 262975416643773
    },
    "cabs": {
      "file": "units/cabs.hbc",
      "hash": "sha256:0ef871d161ec72843e00b0b3a681e2c27220483da22ff792d610e4c5f4d520fd",
      "size": 1092,
      "zstdSize": 784,
      "entryModuleId": 11960423920495
    },
    "travelplex": {
      "file": "units/travelplex.hbc",
      "hash": "sha256:96beefa72881b9ed3d0d2237ea0b14f6a7f97fc64a00339c721f415eff09bd3d",
      "size": 936,
      "zstdSize": 684,
      "entryModuleId": 154661352327660
    }
  },
  "ids": {
    "file": "ids.json",
    "hash": "sha256:dacf98092fe50097cbb39e6ba147b3d4fc96970230a31a4ab6be7f40e47009c3"
  },
  "unitsMap": {
    "file": "units.json",
    "hash": "sha256:bbbbb9db8fd08bb5f41dac339bff55433ab1e068d1890aa62e766aadd68684ce"
  },
  "delta": {
    "enabled": false,
    "baseBuild": null,
    "files": {
      "host.hbc": {
        "js": "sha256:a59f733546fc82687cd08092e6d64850213f7abed7e6fd8c513237c1f9fc9c90"
      },
      "units/bus.hbc": {
        "js": "sha256:56f846ccb005c6390005b51639b9267736eccdadadcf9263ad25c9328148fa6c"
      },
      "units/cabs.hbc": {
        "js": "sha256:1f74c711c17c6834eb6d274a711e51193a876afc40ad847574bc76087a6361a6"
      },
      "units/travelplex.hbc": {
        "js": "sha256:44db634b390c05f0ec4337111309dea1f6bb63b3ff44357acb6f23260044bb85"
      }
    }
  }
}
